<?xml-stylesheet type="text/xsl" href="../xsl/grddl.xsl"?>
<IzvestajRoot 
    xmlns:xsi="http://www.w3.org/2001/XMLSchema-instance" 
    xmlns="http://www.izvestaj.com"
    xsi:schemaLocation="http://www.izvestaj.com ../xsd/izvestaj.xsd"
    
    datum="2021-02-03" about="http://izvestaji/20210203230315" 
    property="http://www.tim21.com/predicate/year" id="20210203230315" content="2021" 
    >
    <Izvestaj>
        <FizickoLice>
            <BrojZahteva>101</BrojZahteva>
            <BrojOdbijenihZahteva>230</BrojOdbijenihZahteva>
            <BrojZalbiOdluka>3</BrojZalbiOdluka>
            <BrojZalbiCutanje>1</BrojZalbiCutanje>
        </FizickoLice>
        <PravnoLice>
            <BrojZahteva>0</BrojZahteva>
            <BrojOdbijenihZahteva>0</BrojOdbijenihZahteva>
            <BrojZalbiOdluka>1</BrojZalbiOdluka>
            <BrojZalbiCutanje>0</BrojZalbiCutanje>
        </PravnoLice>
    </Izvestaj>
</IzvestajRoot>